{
  "schema_version": 2,
  "variables": [{ "name": "rfc", "source": "user.fiscal.rfc", "required": true }],
  "actions": [
    { "id": "open", "action": "goto", "url": "https://facturacion.comercio.mx/" },
    {
      "id": "fill-rfc",
      "action": "fill",
      "locator": { "strategy": "role", "role": "textbox", "name": "RFC" },
      "value": "{{rfc}}"
    },
    {
      "id": "submit",
      "action": "click",
      "locator": { "strategy": "role", "role": "button", "name": "Generar" }
    }
  ],
  "edges": [
    { "from": "open", "to": "fill-rfc" },
    { "from": "fill-rfc", "to": "submit" }
  ],
  "completion": {
    "mode": "all",
    "assertions": [
      {
        "type": "selector_text",
        "locator": { "strategy": "css", "value": "#resultado" },
        "contains": "solicitud completada"
      }
    ]
  }
}
